{
  "profileId": "board_m5stack_cores3_gnss_v1",
  "familyKey": "board:m5stack_cores3_gnss_v1",
  "status": "known-family",
  "createdAt": "2026-03-29T13:41:50.532Z",
  "updatedAt": "2026-03-29T19:03:18.130Z",
  "boardIds": [
    "m5stack_cores3_gnss_v1"
  ],
  "sampleUnitIds": [
    "mac:48:27:e2:66:b0:04"
  ],
  "fingerprint": {
    "fingerprintKey": "board:m5stack_cores3_gnss_v1",
    "vid": "303A",
    "pid": "1001",
    "chipFamily": "esp32-s3",
    "chip": "ESP32-S3 (QFN56) (revision v0.2)",
    "description": "USB Serial Device",
    "name": "USB Serial Device (COM4)",
    "firmwareSignature": "board_manager_cores3_gnss_demo",
    "capabilities": [
      "audio",
      "battery",
      "bluetooth_le",
      "display",
      "gnss",
      "imu",
      "jtag",
      "rtc",
      "touch",
      "uart",
      "usb",
      "wifi"
    ],
    "manufacturer": "Microsoft",
    "service": "usbser",
    "containerId": "{116bb454-e963-5409-9406-30549791eacc}",
    "locationInformation": "0000.0014.0000.005.003.000.000.000.000",
    "baseUsbIdentity": "USB\\VID_303A&PID_1001&MI_00\\7&2d2626df&0&0000",
    "relatedServices": [],
    "relatedFunctionNames": []
  },
  "notes": [
    "Discovery created this family profile from known board observations.",
    "Review this profile and replace generic fingerprint data with a proper board definition match when known."
  ],
  "exactBoard": {
    "boardId": "m5stack_cores3_gnss_v1",
    "displayName": "M5Stack CoreS3 + GNSS Module",
    "revision": "1.0",
    "vendor": "M5Stack",
    "productSku": "K128+M135",
    "controllerModuleId": "m5stack_cores3_controller",
    "chipFamily": "esp32-s3",
    "platformSdk": "esp-idf",
    "capabilities": [
      "audio",
      "battery",
      "bluetooth_le",
      "display",
      "gnss",
      "imu",
      "jtag",
      "rtc",
      "touch",
      "uart",
      "usb",
      "wifi"
    ],
    "sources": [
      "https://docs.m5stack.com/en/core/CoreS3",
      "https://docs.m5stack.com/en/products/sku/M135",
      "https://docs.m5stack.com/en/guide/dip_switch/module_gnss/pins_change"
    ]
  },
  "candidateBoards": [
    {
      "boardId": "m5stack_cores3_gnss_v1",
      "displayName": "M5Stack CoreS3 + GNSS Module",
      "revision": "1.0",
      "vendor": "M5Stack",
      "productSku": "K128+M135",
      "controllerModuleId": "m5stack_cores3_controller",
      "chipFamily": "esp32-s3",
      "platformSdk": "esp-idf",
      "capabilities": [
        "audio",
        "battery",
        "bluetooth_le",
        "display",
        "gnss",
        "imu",
        "jtag",
        "rtc",
        "touch",
        "uart",
        "usb",
        "wifi"
      ],
      "sources": [
        "https://docs.m5stack.com/en/core/CoreS3",
        "https://docs.m5stack.com/en/products/sku/M135",
        "https://docs.m5stack.com/en/guide/dip_switch/module_gnss/pins_change"
      ],
      "score": 100,
      "reasons": [
        "Exact board definition match from discovery history"
      ]
    },
    {
      "boardId": "m5stack_dial_v1_1",
      "displayName": "M5Stack Dial V1.1",
      "revision": "1.1",
      "vendor": "M5Stack",
      "productSku": "K130",
      "controllerModuleId": "m5stamps3",
      "chipFamily": "esp32-s3",
      "platformSdk": "esp-idf",
      "capabilities": [
        "display",
        "rfid",
        "rotaryEncoder",
        "rtc",
        "touch",
        "usb",
        "wifi"
      ],
      "sources": [
        "https://docs.m5stack.com/en/core/M5Dial",
        "https://docs.m5stack.com/en/core/M5Dial%20V1.1"
      ],
      "score": 14,
      "reasons": [
        "Chip family matches esp32-s3",
        "Espressif USB fingerprint fits an ESP32 board",
        "Capabilities overlap: display, rtc, touch, usb, wifi"
      ]
    },
    {
      "boardId": "esp32_dev_relay_v1",
      "displayName": "ESP32 Dev Relay V1",
      "revision": "1.0",
      "vendor": "Generic",
      "productSku": "sample-esp32-relay-v1",
      "controllerModuleId": "esp32_wroom_32",
      "chipFamily": "esp32",
      "platformSdk": "esp-idf",
      "capabilities": [
        "bluetooth",
        "uart",
        "wifi"
      ],
      "sources": [],
      "score": 5,
      "reasons": [
        "Espressif USB fingerprint fits an ESP32 board",
        "Capabilities overlap: uart, wifi"
      ]
    },
    {
      "boardId": "p_nucleo_usb001_f072rb_v1",
      "displayName": "P-NUCLEO-USB001 (Nucleo-F072RB)",
      "revision": "1.0",
      "vendor": "STMicroelectronics",
      "productSku": "P-NUCLEO-USB001",
      "controllerModuleId": "nucleo_f072rb_controller",
      "chipFamily": "stm32f0",
      "platformSdk": "stm32cube",
      "capabilities": [
        "jtag",
        "powerDelivery",
        "uart",
        "usb"
      ],
      "sources": [
        "https://www.st.com/en/evaluation-tools/p-nucleo-usb001.html",
        "https://estore.st.com/en/nucleo-f072rb-cpn.html",
        "https://www.st.com/resource/en/product_presentation/stswstusb006quickstartv1.pdf"
      ],
      "score": 3,
      "reasons": [
        "Capabilities overlap: jtag, uart, usb"
      ]
    },
    {
      "boardId": "stm32_nucleo_io_v1",
      "displayName": "STM32 Nucleo IO V1",
      "revision": "1.0",
      "vendor": "STMicroelectronics",
      "productSku": "sample-stm32-nucleo-io-v1",
      "controllerModuleId": "nucleo_f446re_controller",
      "chipFamily": "stm32f4",
      "platformSdk": "stm32cube",
      "capabilities": [
        "jtag",
        "uart",
        "usb"
      ],
      "sources": [],
      "score": 3,
      "reasons": [
        "Capabilities overlap: jtag, uart, usb"
      ]
    }
  ]
}
